{
    "actions": {
        "Strength": {}
    },
    "armies": {
        "Rohan": {
            "tier": "Hero ofFortitude",
            "selectableInWarband": false,
            "warbandSize": 12
        }
    },
    "magic": {},
    "modelCount": 1,
    "mounts": {},
    "name": "Grimbold Of Grimslade",
    "unique": true,
    "uniqueName": "Grimbold Of Grimslade",
    "points": 60,
    "race": {
        "Man": {},
        "Rohan": {}
    },
    "rules": {
        "Might Blow": {
            "type": "Passive"
        }
    },
    "stats": {
        "movement": 6,
        "fight": 5,
        "range": 4,
        "strength": 4,
        "defence": 5,
        "attacks": 2,
        "wounds": 2,
        "courage": 4,
        "might": {
            "additional": 0,
            "points": 0,
            "value": 3
        },
        "will": {
            "additional": 0,
            "points": 0,
            "value": 1
        },
        "fate": {
            "additional": 0,
            "points": 0,
            "value": 1
        }
    },
    "type": {
        "Infantry": {}
    },
    "wargear": {
        "Armour": {
            "optional": false,
            "points": 0,
            "type": "Passive",
            "userSelected": false
        },
        "Two-Handed Axe": {
            "optional": false,
            "points": 0,
            "type": "Passive",
            "userSelected": false
        }
    },
    "references": {
        "books": {
            "Armies Of The Lord Of The Rings": {
                "page": 65,
                "initials": "AotLotR"
            }
        }
    },
    "version": 1.0
}