{
    "actions": {
        "Strike": {},
        "Resolve": {}
    },
    "armies": {
        "The Shire": {
            "tier": "Hero of Fortitude",
            "selectableInWarband": false,
            "warbandSize": 12
        }
    },
    "magic": {},
    "modelCount": 1,
    "mounts": {
        "Pony": {
            "points": 5,
            "userSelected": false
        }
    },
    "name": "Samwise The Brave",
    "unique": true,
    "uniqueName": "Samwise",
    "points": 45,
    "race": {
        "Hobbit": {}
    },
    "rules": {
        "Resistant To Magic": {
            "type": "Passive"
        },
        "Throw Stones (Hobbit)": {
            "type": "Active"
        }
    },
    "stats": {
        "movement": 4,
        "fight": 3,
        "range": 3,
        "strength": 2,
        "defence": 3,
        "attacks": 1,
        "wounds": 2,
        "courage": 6,
        "might": {
            "additional": 0,
            "points": 0,
            "value": 2
        },
        "will": {
            "additional": 0,
            "points": 0,
            "value": 2
        },
        "fate": {
            "additional": 0,
            "points": 0,
            "value": 3
        }
    },
    "type": {
        "Infantry": {}
    },
    "wargear": {
        "Elven Cloak": {
            "optional": true,
            "points": 5,
            "type": "Passive",
            "userSelected": false
        },
        "Sting": {
            "optional": false,
            "points": 0,
            "type": "Passive",
            "userSelected": true,
            "unique": true
        }
    },
    "references": {
        "books": {
            "Armies Of The Lord Of The Rings": {
                "page": 17,
                "initials": "AotLotR"
            }
        }
    },
    "version": 1.0
}