{
    "actions": {
        "Defence": {}
    },
    "armies": {
        "Rohan": {
            "tier": "Hero Of Fortitude",
            "selectableInWarband": false,
            "warbandSize": 12
        }
    },
    "magic": {},
    "modelCount": 1,
    "mounts": {
        "Horse": {
            "points": 10,
            "userSelected": false
        }
    },
    "name": "Háma, Captain Of Rohan",
    "unique": true,
    "uniqueName": "Háma",
    "points": 55,
    "race": {
        "Man": {},
        "Rohan": {}
    },
    "rules": {
        "Expert Rider": {
            "type": "Passive"
        },
        "Horse Lord": {
            "type": "Passive"
        },
        "Sworn Protector": {
            "type": "Passive",
            "additional": "Théoden"
        }
    },
    "stats": {
        "movement": 6,
        "fight": 4,
        "range": 4,
        "strength": 4,
        "defence": 6,
        "attacks": 2,
        "wounds": 2,
        "courage": 4,
        "might": {
            "additional": 0,
            "points": 0,
            "value": 3
        },
        "will": {
            "additional": 0,
            "points": 0,
            "value": 1
        },
        "fate": {
            "additional": 0,
            "points": 0,
            "value": 1
        }
    },
    "type": {
        "Infantry": {}
    },
    "wargear": {
        "Heavy Armour": {
            "optional": false,
            "points": 0,
            "type": "Passive",
            "userSelected": false
        },
        "Sword": {
            "optional": false,
            "points": 0,
            "type": "Passive",
            "userSelected": false
        }
    },
    "references": {
        "books": {
            "Armies Of The Lord Of The Rings": {
                "page": 65,
                "initials": "AotLotR"
            }
        }
    },
    "version": 1.0
}