{
    "actions": {
        "Channelling": {},
        "Resolve": {}
    },
    "armies": {
        "Rivendell": {
            "tier": "Hero of Fortitude",
            "selectableInWarband": false,
            "warbandSize": 12
        }
    },
    "magic": {
        "Aura Of Command": {
            "range": 0,
            "casting": 2
        },
        "Blinding Light": {
            "range": 0,
            "casting": 2
        },
        "Enchanted Blades": {
            "range": 6,
            "casting": 4
        },
        "Aura Of Dismay": {
            "range": 0,
            "casting": 5
        }
    },
    "modelCount": 1,
    "mounts": {},
    "name": "Círdan",
    "unique": true,
    "uniqueName": "Círdan",
    "points": 80,
    "race": {
        "Elf": {},
        "Rivendell": {}
    },
    "rules": {
        "Resistant To Magic": {
            "type": "Passive"
        },
        "Woodland Creature": {
            "type": "Passive"
        },
        "Terror": {
            "type": "Passive"
        },
        "The Shipwright's Power": {
            "type": "Passive",
            "asterisk": "*"
        }
    },
    "stats": {
        "movement": 6,
        "fight": 5,
        "range": 3,
        "strength": 4,
        "defence": 4,
        "attacks": 1,
        "wounds": 2,
        "courage": 6,
        "might": {
            "additional": 0,
            "points": 0,
            "value": 1
        },
        "will": {
            "additional": 0,
            "points": 0,
            "value": 4,
            "asterisk": "*"
        },
        "fate": {
            "additional": 0,
            "points": 0,
            "value": 1
        }
    },
    "type": {
        "Infantry": {}
    },
    "wargear": {
        "Unarmed": {
            "optional": false,
            "points": 0,
            "type": "Passive",
            "userSelected": false
        }
    },
    "references": {
        "books": {
            "Armies Of The Lord Of The Rings": {
                "page": 78,
                "initials": "AotLotR"
            }
        }
    },
    "version": 1.0
}