{
    "actions": {
        "Strike": {},
        "Strength": {},
        "Defence": {}
    },
    "armies": {
        "Minas Tirith": {
            "tier": "Hero of Valour",
            "selectableInWarband": false,
            "warbandSize": 15
        }
    },
    "magic": {},
    "modelCount": 1,
    "mounts": {
        "Horse": {
            "points": 10,
            "userSelected": false
        }
    },
    "name": "Boromir, Captain Of The White Tower",
    "unique": true,
    "uniqueName": "Boromir",
    "points": 160,
    "race": {
        "Man": {},
        "Gondor": {}
    },
    "rules": {},
    "stats": {
        "movement": 6,
        "fight": 6,
        "range": 4,
        "strength": 4,
        "defence": 6,
        "attacks": 3,
        "wounds": 3,
        "courage": 6,
        "might": {
            "additional": 0,
            "points": 0,
            "value": 6
        },
        "will": {
            "additional": 0,
            "points": 0,
            "value": 3
        },
        "fate": {
            "additional": 0,
            "points": 0,
            "value": 3
        }
    },
    "type": {
        "Infantry": {}
    },
    "wargear": {
        "Sword": {
            "optional": false,
            "points": 0,
            "type": "Passive",
            "userSelected": false
        },
        "Heavy Armour": {
            "optional": false,
            "points": 0,
            "type": "Passive",
            "userSelected": false
        },
        "Horn Of Gondor": {
            "optional": false,
            "points": 0,
            "type": "Passive",
            "userSelected": false
        },
        "Banner of Minas Tirith": {
            "optional": true,
            "points": 40,
            "type": "Passive",
            "userSelected": false
        },
        "Lance": {
            "optional": true,
            "points": 5,
            "type": "Passive",
            "userSelected": false
        },
        "Shield": {
            "optional": true,
            "points": 5,
            "type": "Passive",
            "userSelected": false
        }
    },
    "references": {
        "books": {
            "Armies Of The Lord Of The Rings": {
                "page": 36,
                "initials": "AotLotR"
            }
        }
    },
    "version": 1.0
}