{
    "actions": {},
    "armies": {
        "Rohan": {
            "tier": "Warrior",
            "selectableInWarband": true,
            "warbandSize": 0
        }
    },
    "magic": {},
    "modelCount": 1,
    "mounts": {
        "Horse": {
            "points": 5,
            "userSelected": false
        }
    },
    "name": "Rohan Royal Guard",
    "unique": false,
    "points": 10,
    "race": {
        "Man": {},
        "Rohan": {}
    },
    "rules": {
        "Bodyguard": {
            "type": "Passive"
        },
        "Expert Rider": {
            "type": "Passive"
        },
        "Arise Riders Of Th√©oden": {
            "type": "Active"
        }
    },
    "stats": {
        "movement": 6,
        "fight": 4,
        "range": 4,
        "strength": 3,
        "defence": 6,
        "attacks": 1,
        "wounds": 1,
        "courage": 3
    },
    "type": {
        "Infantry": {}
    },
    "wargear": {
        "Heavy Armour": {
            "optional": false,
            "points": 0,
            "type": "Passive",
            "userSelected": false
        },
        "Sword": {
            "optional": false,
            "points": 0,
            "type": "Passive",
            "userSelected": false
        },
        "Shield": {
            "optional": false,
            "points": 0,
            "type": "Passive",
            "userSelected": false
        },
        "Banner": {
            "optional": true,
            "points": 25,
            "type": "Passive",
            "userSelected": false
        },
        "Throwing Spears": {
            "optional": true,
            "points": 2,
            "type": "Passive",
            "userSelected": false
        }
    },
    "references": {
        "books": {
            "Armies Of The Lord Of The Rings": {
                "page": 68,
                "initials": "AotLotR"
            }
        }
    },
    "version": 1.0
}