{
    "actions": {
        "Strength": {}
    },
    "armies": {
        "The Kingdom Of Khazad-Dûm": {
            "tier": "Hero of Fortitude",
            "selectableInWarband": false,
            "warbandSize": 12
        }
    },
    "magic": {},
    "modelCount": 1,
    "mounts": {},
    "name": "Flói Stonehand",
    "unique": true,
    "uniqueName": "Flói Stonehand",
    "points": 75,
    "race": {
        "Dwarf": {},
        "Moria": {}
    },
    "rules": {
        "Loremaster": {
            "type": "Active"
        }
    },
    "stats": {
        "movement": 5,
        "fight": 4,
        "range": 4,
        "strength": 4,
        "defence": 6,
        "attacks": 2,
        "wounds": 2,
        "courage": 5,
        "might": {
            "current": 1
        },
        "will": {
            "current": 3
        },
        "fate": {
            "current": 1
        }
    },
    "type": {
        "Infantry": {}
    },
    "wargear": {
        "Heavy Dwarf Armour": {
            "optional": false,
            "points": 0,
            "type": "Passive",
            "userSelected": false
        },
        "Staff": {
            "optional": false,
            "points": 0,
            "type": "Active",
            "userSelected": false
        }
    },
    "references": {
        "books": {
            "Armies Of The Lord Of The Rings": {
                "page": 98,
                "initials": "AotLotR"
            }
        }
    },
    "version": 1.0
}