{
    "actions": {
        "March": {},
        "Defence": {}
    },
    "armies": {
        "Minas Tirith": {
            "tier": "Hero of Fortitude",
            "selectableInWarband": false,
            "warbandSize": 12
        }
    },
    "magic": {},
    "modelCount": 1,
    "mounts": {
        "Armoured Horse": {
            "points": 15,
            "userSelected": false
        },
        "Horse": {
            "points": 10,
            "userSelected": false
        }
    },
    "name": "King Of Men",
    "unique": false,
    "points": 60,
    "race": {
        "Man": {},
        "Gondor": {}
    },
    "rules": {},
    "stats": {
        "movement": 6,
        "fight": 5,
        "range": 4,
        "strength": 4,
        "defence": 5,
        "attacks": 2,
        "wounds": 2,
        "courage": 5,
        "might": {
            "additional": 0,
            "points": 0,
            "value": 2
        },
        "will": {
            "additional": 0,
            "points": 0,
            "value": 2
        },
        "fate": {
            "additional": 0,
            "points": 0,
            "value": 1
        }
    },
    "type": {
        "Infantry": {}
    },
    "wargear": {
        "Armour": {
            "optional": false,
            "points": 0,
            "type": "Passive",
            "userSelected": false
        },
        "Sword": {
            "optional": false,
            "points": 0,
            "type": "Passive",
            "userSelected": false
        },
        "Heavy Armour": {
            "optional": true,
            "points": 5,
            "type": "Passive",
            "userSelected": false
        },
        "Lance": {
            "optional": true,
            "points": 5,
            "type": "Passive",
            "userSelected": false
        },
        "Shield": {
            "optional": true,
            "points": 5,
            "type": "Passive",
            "userSelected": false
        }
    },
    "references": {
        "books": {
            "Armies Of The Lord Of The Rings": {
                "page": 40,
                "initials": "AotLotR"
            }
        }
    },
    "version": 1.0
}