{
    "actions": {
        "Strike": {},
        "Strength": {}
    },
    "armies": {
        "The Fellowship": {
            "tier": "Hero of Fortitude",
            "selectableInWarband": false,
            "warbandSize": 0
        }
    },
    "magic": {},
    "modelCount": 1,
    "mounts": {},
    "name": "Samwise Gamgee",
    "unique": true,
    "uniqueName": "Samwise",
    "points": 40,
    "race": {
        "Hobbit": {}
    },
    "rules": {
        "Resistant To Magic": {
            "type": "Passive"
        },
        "Throw Stones (Hobbit)": {
            "type": "Active"
        },
        "Let Him Go Or I'll Have You, Longshanks!": {
            "type": "Active"
        }
    },
    "stats": {
        "movement": 4,
        "fight": 3,
        "range": 3,
        "strength": 2,
        "defence": 3,
        "attacks": 1,
        "wounds": 2,
        "courage": 6,
        "might": {
            "current": 2
        },
        "will": {
            "current": 2
        },
        "fate": {
            "current": 2
        }
    },
    "type": {
        "Infantry": {}
    },
    "wargear": {
        "Dagger": {
            "optional": false,
            "points": 0,
            "type": "Passive",
            "userSelected": false
        },
        "Elven Cloak": {
            "optional": true,
            "points": 5,
            "type": "Passive",
            "userSelected": false
        }
    },
    "references": {
        "books": {
            "Armies Of The Lord Of The Rings": {
                "page": 9,
                "initials": "AotLotR"
            }
        }
    },
    "version": 1.0
}