{
    "actions": {
        "Accuracy": {},
        "Strike": {},
        "Strength": {}
    },
    "armies": {
        "Lothlórien": {
            "tier": "Hero of Fortitude",
            "selectableInWarband": false,
            "warbandSize": 12
        }
    },
    "magic": {},
    "modelCount": 1,
    "mounts": {},
    "name": "Haldir",
    "unique": true,
    "uniqueName": "Haldir",
    "points": 70,
    "race": {
        "Elf": {},
        "Lόrien": {}
    },
    "rules": {
        "Expert Shot": {
            "type": "Passive"
        },
        "Woodland Creature": {
            "type": "Passive"
        },
        "Allies 'Til The End": {
            "type": "Passive"
        },
        "One Final Blow": {
            "type": "Active"
        }
    },
    "stats": {
        "movement": 6,
        "fight": 6,
        "range": 3,
        "strength": 4,
        "defence": 4,
        "attacks": 2,
        "wounds": 2,
        "courage": 6,
        "might": {
            "additional": 0,
            "points": 0,
            "value": 3
        },
        "will": {
            "additional": 0,
            "points": 0,
            "value": 1
        },
        "fate": {
            "additional": 0,
            "points": 0,
            "value": 1
        }
    },
    "type": {
        "Infantry": {}
    },
    "wargear": {
        "Elven-Made Hand-And-A-Half Sword": {
            "optional": false,
            "points": 0,
            "type": "Passive",
            "userSelected": false
        },
        "Heavy Armour": {
            "optional": true,
            "points": 10,
            "type": "Passive",
            "userSelected": false
        },
        "Elf Bow": {
            "optional": true,
            "points": 5,
            "type": "Passive",
            "userSelected": false
        },
        "Elven Cloak": {
            "optional": true,
            "points": 5,
            "type": "Passive",
            "userSelected": false
        }
    },
    "references": {
        "books": {
            "Armies Of The Lord Of The Rings": {
                "page": 85,
                "initials": "AotLotR"
            }
        }
    },
    "version": 1.0
}