{
    "actions": {},
    "armies": {
        "The Shire": {
            "tier": "Minor Hero",
            "selectableInWarband": false,
            "warbandSize": 6
        }
    },
    "magic": {},
    "modelCount": 1,
    "mounts": {},
    "name": "Fredegar Bolger",
    "unique": true,
    "uniqueName": "Fredegar Bolger",
    "points": 10,
    "race": {
        "Hobbit": {}
    },
    "rules": {
        "Resistant To Magic": {
            "type": "Passive"
        },
        "Throw Stones (Hobbit)": {
            "type": "Active"
        }
    },
    "stats": {
        "movement": 4,
        "fight": 2,
        "range": 3,
        "strength": 2,
        "defence": 3,
        "attacks": 1,
        "wounds": 1,
        "courage": 3,
        "might": {
            "current": 0
        },
        "will": {
            "current": 0
        },
        "fate": {
            "current": 1
        }
    },
    "type": {
        "Infantry": {}
    },
    "wargear": {
        "Unarmed": {
            "optional": false,
            "points": 0,
            "type": "Passive",
            "userSelected": false
        }
    },
    "references": {
        "books": {
            "Armies Of The Lord Of The Rings": {
                "page": 20,
                "initials": "AotLotR"
            }
        }
    },
    "version": 1.0
}